id,appTitle,userName,date,score,text,fileDate,fileCategories,contentRating,appId,reviewId,processed_text,label_UE,label_BR,label_FR,label_R
388739,The PCH App,Ava Dawkins,14-Mar-19,5,I enjoy this app. It has a lot of informative ads. I have seen a lot of products I might not have seen otherwise. Thank you,2019-04-21,LIFESTYLE,Everyone,pch.apps.pchsweeps,652762,I enjoy this app. It has a lot of informative ads. I have seen a lot of products I might not have seen otherwise. Thank you,0,0,0,1
135165,Headspace: Meditation & Sleep,A Google User,07-Dec-18,3,All the meditation segments are the same,2019-04-21,FITNESS,Everyone,com.getsomeheadspace.android,185231,All the meditation segments are the same,0,0,1,0
50299,Samsung Health,Jason Cronk,14-Feb-19,5,Simply a fantastic App.,2019-03-16,FITNESS,Everyone,com.sec.android.app.shealth,68870,Simply a fantastic App.,0,0,0,1
218704,Tomb of the Mask,,04-Mar-19,5,its so fun,2019-03-08,ACTION,Everyone,com.playgendary.tom,324314,its so fun,0,0,0,1
458042,"Hulu: Stream TV, Movies & more",Ethel Pogue,08-Feb-19,3,Good movies. Need less commercials.,2019-04-21,ENTERTAINMENT,Teen,com.hulu.plus,788541,Good movies. Need less commercials.,0,0,0,1
668693,Photomath,,13-Feb-19,5,Easy to use.,2019-03-08,EDUCATION,Everyone,com.microblink.photomath,1132261,Easy to use.,0,0,0,1
787757,Google Classroom,General Luke Productions,15-Sep-18,3,Good App for school,2019-04-21,EDUCATION,Everyone,com.google.android.apps.classroom,1308098,Good App for school,0,0,0,1
263382,Kick the Buddy,l“€‘_lã€ l“€‘_lã€,16-Apr-19,1,INAPROPRIATE BECAUSE SOME KICK THE BUDDY MWTHOD ELECTRIC CHAIR REAL EXICUTE METHOD IN THE WORLD THIS GAME FALG INAPROPRIATE,2019-04-21,ACTION,Teen,com.playgendary.kickthebuddy,414254,INAPROPRIATE BECAUSE SOME KICK THE BUDDY MWTHOD ELECTRIC CHAIR REAL EXICUTE METHOD IN THE WORLD THIS GAME FALG INAPROPRIATE,0,0,0,1
172847,CVS/pharmacy,Glenn Bullion,22-Mar-19,1,It doesn't work. Sorry.,2019-03-24,FITNESS,Everyone,com.cvs.launchers.cvs,244908,It doesn't work. Sorry.,0,0,0,1
238554,Snowball.io,Alan Burgess,10-Mar-19,5,I Love you,2019-03-24,ACTION,Everyone,com.geishatokyo.snowballio,359932,I Love you,0,0,0,1
953192,Zelle,Brvo gon,21-Sep-18,1,"I have this app for like a while now and trying to open an account. Everytime i try there's an error. And now i tried again. Still bad. Stuck at the verification for 2 days now. Use Venmo, much better.",2019-04-07,FINANCE,Everyone,com.zellepay.zelle,1563919,"I have this app for like a while now and trying to open an account. Everytime i try there's an error. And now i tried again. Still bad. Stuck at the verification for 2 days now. Use Venmo, much better.",0,1,0,0
326090,Family Locator - GPS Tracker,gamer galatic,27-Feb-19,5,this is so easy to know were the person is,2019-03-13,LIFESTYLE,Everyone,com.life360.android.safetymapd,547466,this is so easy to know were the person is,0,0,0,1
452132,"Hulu: Stream TV, Movies & more",Davey Houston,09-Apr-19,1,cannot get through on phone says no. is invalid but I called it this morning and spoke to agent about changing my bill payment date.,2019-04-14,ENTERTAINMENT,Teen,com.hulu.plus,780104,cannot get through on phone says no. is invalid but I called it this morning and spoke to agent about changing my bill payment date.,0,1,0,0
457572,"Hulu: Stream TV, Movies & more",Aiden marky HI,17-Apr-19,1,terrible to many ads and you cant even skip them.,2019-04-21,ENTERTAINMENT,Teen,com.hulu.plus,787836,terrible to many ads and you cant even skip them.,0,0,0,1
1065522,WildCraft: Animal Sim Online 3D,A Google User,14-Feb-19,5,THis GAME IS REALLY AMAZING _ôï_ô_,2019-04-01,FAMILY,Everyone 10+,com.turborocketgames.wildcraft,1760921,THis GAME IS REALLY AMAZING ,0,0,0,1
625127,Drum Pad Machine - Make Beats,Obi O,18-Feb-19,5,Why I try to make good music when I recorded it then it felt better,2019-03-09,AUDIO,Everyone,com.agminstruments.drumpadmachine,1062102,Why I try to make good music when I recorded it then it felt better,0,0,0,1
957813,Zelle,M Kamai,21-Jun-18,1,"Want's too much personal information.  Missed the documentation about it being purely person-to-person and they would not accept our social club's businesscard debit card.  Pain in the 6th-point-of-contact to get in touch with their tech support to verify why it would not accept the card, then delete my account.  Once I figured out how to get a human being, was able to inactivate the account, and hopefully it gets deleted as they said in 24 hours",2019-03-24,FINANCE,Everyone,com.zellepay.zelle,1569383,"Want's too much personal information.  Missed the documentation about it being purely person-to-person and they would not accept our social club's businesscard debit card.  Pain in the 6th-point-of-contact to get in touch with their tech support to verify why it would not accept the card, then delete my account.  Once I figured out how to get a human being, was able to inactivate the account, and hopefully it gets deleted as they said in 24 hours",1,0,0,0
86390,Calorie Counter - MyFitnessPal,Linda D Trevino,07-Mar-19,5,Love this ap use it along with my Ww and intermittent fasting.,2019-03-16,FITNESS,Everyone,com.myfitnesspal.android,123415,Love this ap use it along with my Ww and intermittent fasting.,0,0,0,1
923284,Credit Karma,,03-Mar-19,4,Its easy to use.,2019-03-08,FINANCE,Everyone,com.creditkarma.mobile,1518831,Its easy to use.,0,0,0,1
505612,Roku,Ninja Gonzales,13-Feb-19,5,better than expected,2019-03-13,ENTERTAINMENT,Teen,com.roku.remote,864597,better than expected,0,0,0,1
979704,Bank of America Mobile Banking,Patrice Flores,14-Apr-19,2,"Keep it simple. The old bill pay was superior. Erica is not needed. I use the app for banking, not to be entertained. I want quick access to my data, do simple transactions and that's it. Please don't add dancing cows next update.",2019-04-14,FINANCE,Everyone,com.infonow.bofa,1600844,"Keep it simple. The old bill pay was superior. Erica is not needed. I use the app for banking, not to be entertained. I want quick access to my data, do simple transactions and that's it. Please don't add dancing cows next update.",0,0,1,0
639590,Apple Music,Brando Lí_pez,22-Mar-19,4,"This app is doing well. What I like you to implement is the possibility of casting through Chromecast, and set a timer.",2019-03-24,AUDIO,Teen,com.apple.android.music,1083184,"This app is doing well. What I like you to implement is the possibility of casting through Chromecast, and set a timer.",0,0,1,1
1083938,WildCraft: Animal Sim Online 3D,Linda Matulonis,22-Mar-19,5,Really fun and a great way to meet new people,2019-04-21,FAMILY,Everyone 10+,com.turborocketgames.wildcraft,1783878,Really fun and a great way to meet new people,0,0,0,1
794352,PBS KIDS Video,TUTY Mc Fruity,11-Mar-17,5,Its a master piece my son loves it his favorite is Daniel tiger neighborhood,2019-03-08,EDUCATION,Everyone,org.pbskids.video,1318479,Its a master piece my son loves it his favorite is Daniel tiger neighborhood,0,0,0,1
553574,Spotify - Music and Podcasts,Mali Rowe,12-Apr-19,3,"can someone help? i am only able to download an entire podcast if i press the little download button on every single episode. i looked up the question on google and found: ""To save an artist's entire discography you would have to click the ""+"" next to every song to save it to your ""songs"" section which also will save it under Avicii in the artists section. Or you can add every song to a playlist."" this seems really unreasonable, especially considering i signed up for the paid plan.",2019-04-14,AUDIO,Teen,com.spotify.music,944204,"can someone help? i am only able to download an entire podcast if i press the little download button on every single episode. i looked up the question on google and found: ""To save an artist's entire discography you would have to click the ""+"" next to every song to save it to your ""songs"" section which also will save it under Avicii in the artists section. Or you can add every song to a playlist."" this seems really unreasonable, especially considering i signed up for the paid plan.",0,1,0,0
374819,FaceApp,Valeary Puniani,30-Mar-19,5,thank you _ôÖ,2019-04-01,LIFESTYLE,Everyone,io.faceapp,628508,thank you ,0,0,0,1
297049,Battle Royale: FPS Shooter,SHOPE MAN,31-Mar-19,1,it sucks ur guy looks stupid and it sucks so bad they couldnt get more than 4 people in my game.,2019-04-21,ACTION,Teen,com.fpsshooter.battleroyale,489663,it sucks ur guy looks stupid and it sucks so bad they couldnt get more than 4 people in my game.,0,0,0,1
470506,Tubi - Free Movies & TV Shows,Leslie Smith,04-Apr-19,5,great selection of everything,2019-04-14,ENTERTAINMENT,Teen,com.tubitv,808293,great selection of everything,0,0,0,1
750324,ClassDojo,Gina luxurioux,07-Nov-18,1,I hate it because every time the teachers always snitch. On you,2019-04-14,EDUCATION,Everyone,com.classdojo.android,1250637,I hate it because every time the teachers always snitch. On you,0,0,0,1
16901,"Calm - Meditate, Sleep, Relax",Grady Hengel,25-Mar-19,1,you have to pay for everything not worth the money free app and not free to use,2019-04-14,FITNESS,Everyone,com.calm.android,20229,you have to pay for everything not worth the money free app and not free to use,0,0,0,1
56641,Samsung Health,A Google User,23-Mar-19,1,"Upgraded to latest version 6.2.0.075 & now have several bugs in phone software. Health app data is useless. Samsung Health customer service says they are aware of issues but have no downloadable fix. Syncing phone does not resolve. Now must go to physical store for refresh, which ""might or might not"" cost me money?! >:-(",2019-04-21,FITNESS,Everyone,com.sec.android.app.shealth,79368,"Upgraded to latest version 6.2.0.075 & now have several bugs in phone software. Health app data is useless. Samsung Health customer service says they are aware of issues but have no downloadable fix. Syncing phone does not resolve. Now must go to physical store for refresh, which ""might or might not"" cost me money?! >:-(",0,1,0,0
154692,Lose It! - Calorie Counter,genpennstate,27-Jul-18,5,"Says its free but then on the third day u have to buy in order to keep 
tracking your food. EDIT: I ended up paying for the app because it's BY FAR 
THE BEST TRACKER OUT THERE. It stinks I had to spend 40 bucks (and also 
don't have the option of paying monthly) but it's the best product on the 
market so I guess it's worth it.",2019-04-07,FITNESS,Everyone,com.fitnow.loseit,223173,"Says its free but then on the third day u have to buy in order to keep 
tracking your food. EDIT: I ended up paying for the app because it's BY FAR 
THE BEST TRACKER OUT THERE. It stinks I had to spend 40 bucks (and also 
don't have the option of paying monthly) but it's the best product on the 
market so I guess it's worth it.",1,0,0,1
1058259,Minion Rush: Despicable Me Official Game,,19-Feb-19,4,I think this game is pretty cool.,2019-03-13,FAMILY,Everyone 10+,com.gameloft.android.ANMP.GloftDMHM,1747350,I think this game is pretty cool.,0,0,0,1
466274,Tubi - Free Movies & TV Shows,Jesse Yardley,23-Mar-19,5,Free and good quality!,2019-03-24,ENTERTAINMENT,Teen,com.tubitv,801497,Free and good quality!,0,0,0,1
162347,Lose It! - Calorie Counter,Greg McNally,05-Sep-18,5,Using the free version. Easy logging. Good visual aids especially a weekly graphic of calories. Excellent app.,2019-04-14,FITNESS,Everyone,com.fitnow.loseit,231675,Using the free version. Easy logging. Good visual aids especially a weekly graphic of calories. Excellent app.,0,0,0,1
726332,Duolingo: Learn Languages Free,Anne Markham,12-Mar-19,5,"I took a beginning Spanish class at the local community college and ended up dropping it. Beginners Spanish was not really for beginners. This app is perfect for anyone from beginner to someone brushing up on their skills. I love that it lets me work at my pace, snail, and doesn't make me feel like a failure.",2019-03-13,FAMILY,Everyone,com.duolingo,1214423,"I took a beginning Spanish class at the local community college and ended up dropping it. Beginners Spanish was not really for beginners. This app is perfect for anyone from beginner to someone brushing up on their skills. I love that it lets me work at my pace, snail, and doesn't make me feel like a failure.",1,0,0,0
488297,STARZ,Tanya Jean,20-Oct-18,5,This is gud,2019-03-13,ENTERTAINMENT,Mature 17+,com.bydeluxe.d3.android.program.starz,837045,This is gud,0,0,0,1
209982,Ball Mayhem!,Naeem Woods,26-Feb-19,5,"I like I because it looks,cool",2019-04-14,ACTION,Everyone,com.clement.ballmayhem,310067,"I like I because it looks,cool",0,0,0,1
934074,Chase Mobile,Archie Wong,31-Mar-19,2,does not work with android Q beta. pls fix,2019-04-07,FINANCE,Everyone,com.chase.sig.android,1535628,does not work with android Q beta. pls fix,0,1,0,0
1064950,WildCraft: Animal Sim Online 3D,A Google User,11-Jan-19,5,"Awesome But There are Rake, Rule, Spawncode,Kelly And i heard its 2 more! Its really creepy please do a anti hack thing",2019-04-01,FAMILY,Everyone 10+,com.turborocketgames.wildcraft,1760204,"Awesome But There are Rake, Rule, Spawncode,Kelly And i heard its 2 more! Its really creepy please do a anti hack thing",0,1,1,0
584953,Amazon Alexa,AJautumn,18-Mar-19,2,"I opened the app and it kept telling me to update chrome but when i would, chrome was already up to date and I couldnt open the app. please try to fix this!!!!",2019-04-07,AUDIO,Everyone,com.amazon.dee.app,998660,"I opened the app and it kept telling me to update chrome but when i would, chrome was already up to date and I couldnt open the app. please try to fix this!!!!",0,1,0,0
838063,Kahoot!,Addison and david awsomeness,11-Dec-18,1,It said I was incorrect but there are no wrong answers,2019-03-24,EDUCATION,Everyone,no.mobitroll.kahoot.android,1385761,It said I was incorrect but there are no wrong answers,0,1,0,0
324011,Family Locator - GPS Tracker,A Google User,26-Mar-19,5,great way to keep families safe,2019-04-07,LIFESTYLE,Everyone,com.life360.android.safetymapd,544146,great way to keep families safe,0,0,0,1
1070370,WildCraft: Animal Sim Online 3D,A Google User,09-Mar-19,5,"I love the graphics, game play and everything else! I just wish it's wasn't so hard to change animal. Can you also please add more animals to be? Maybe a zebra? An African update! OooooooOoooOoooOooooOoooOooOoOOOooooo that would be so cool! Also, I got a bunch of cool accessories on my account but then my phone broke and i was locked out of my account. Its been a while now, I can't even remember my username",2019-04-07,FAMILY,Everyone 10+,com.turborocketgames.wildcraft,1766949,"I love the graphics, game play and everything else! I just wish it's wasn't so hard to change animal. Can you also please add more animals to be? Maybe a zebra? An African update! OooooooOoooOoooOooooOoooOooOoOOOooooo that would be so cool! Also, I got a bunch of cool accessories on my account but then my phone broke and i was locked out of my account. Its been a while now, I can't even remember my username",0,0,1,1
662547,SoundCloud - Music & Audio,Ishmael Ansah Bekoe,12-Apr-19,5,the best in all music,2019-04-14,AUDIO,Teen,com.soundcloud.android,1120478,the best in all music,0,0,0,1
170346,CVS/pharmacy,A Google User,21-Feb-19,5,very fast and easily accessible,2019-04-01,FITNESS,Everyone,com.cvs.launchers.cvs,240918,very fast and easily accessible,0,0,0,1
340552,Google Home,Satish J,09-Feb-19,1,"This app has lot of issue, pain in ass to use it",2019-04-07,LIFESTYLE,Everyone,com.google.android.apps.chromecast.app,570081,"This app has lot of issue, pain in ass to use it",0,0,0,1
435756,Netflix,divyansh singh,07-Apr-19,1,Not accepting indian debit cards,2019-04-14,ENTERTAINMENT,Teen,com.netflix.mediaclient,753444,Not accepting indian debit cards,0,1,0,0
99531,Fitbit,James O'Connell,12-Mar-19,2,issues connecting to device,2019-03-24,FITNESS,Everyone,com.fitbit.FitbitMobile,140599,issues connecting to device,0,1,0,0
572777,"iHeartRadio - Free Music, Radio & Podcasts",,16-Mar-19,5,THE BEST APP EVER MADE!! 5/5_ôÖ_ôÖó_ô_„,2019-03-24,AUDIO,Teen,com.clearchannel.iheartradio.controller,977613,THE BEST APP EVER MADE!! 5/5,0,0,0,1
956132,Zelle,Jane Smith,04-Nov-18,1,DO NOT USE THIS IS A SCAM!!!! AND YOU WILL HAVE ABSOLUTELY NO REPERCUSSIONS FOR GETTING YOUR MONEY BACK!!!!! DO NOT USE!!!,2019-03-24,FINANCE,Everyone,com.zellepay.zelle,1567425,DO NOT USE THIS IS A SCAM!!!! AND YOU WILL HAVE ABSOLUTELY NO REPERCUSSIONS FOR GETTING YOUR MONEY BACK!!!!! DO NOT USE!!!,0,0,0,1
600860,Amazon Music,Dakota Miller,28-Mar-19,5,great app. haven't had any problems and 6 people for 15 bucks a month offs awesome.,2019-04-01,AUDIO,Teen,com.amazon.mp3,1021055,great app. haven't had any problems and 6 people for 15 bucks a month offs awesome.,0,0,0,1
665498,Photomath,A Google User,10-Mar-19,5,thanks for the application,2019-04-01,EDUCATION,Everyone,com.microblink.photomath,1126629,thanks for the application,0,0,0,1
201983,Ball Mayhem!,Hawk Jordan,21-Feb-19,5,"Is a great game but im having an issue where i am playing 5 match sets not a 2 minute game, needs attention.",2019-03-08,ACTION,Everyone,com.clement.ballmayhem,296742,"Is a great game but im having an issue where i am playing 5 match sets not a 2 minute game, needs attention.",0,1,0,0
236342,Snowball.io,Leo Morales,26-Mar-19,5,its no wifi and its easy,2019-04-07,ACTION,Everyone,com.geishatokyo.snowballio,355477,its no wifi and its easy,0,0,0,1
473065,Tubi - Free Movies & TV Shows,dee alvarez,04-Mar-19,5,good except for the adds overall is a good free movie TV shows,2019-03-13,ENTERTAINMENT,Teen,com.tubitv,812460,good except for the adds overall is a good free movie TV shows,0,0,0,1
905036,PayPal Mobile Cash: Send and Request Money Fast,Lyndsey Ellis,22-Mar-19,5,"Love paypal! It's so convenient, and I feel safe sending/receiving money!",2019-03-24,FINANCE,Everyone,com.paypal.android.p2pmobile,1489485,"Love paypal! It's so convenient, and I feel safe sending/receiving money!",0,0,0,1
620062,Drum Pad Machine - Make Beats,A Google User,21-Mar-19,5,it is the best for and download it guys make beats and be a star,2019-04-07,AUDIO,Everyone,com.agminstruments.drumpadmachine,1053077,it is the best for and download it guys make beats and be a star,0,0,0,1
39816,Sweatcoin Pays You To Get Fit,Adam Davis,16-Apr-19,1,"Worked for one day, then stopped counting steps",2019-04-21,FITNESS,Everyone,in.sweatco.app,51829,"Worked for one day, then stopped counting steps",0,1,0,0
1117513,Pixel Art: Color by Number,Nichole Grygier,20-Apr-19,5,it is amazing I love pixel art: color by number it helps me become more creative when I have nothing to do!!!!!!,2019-04-21,ENTERTAINMENT,Everyone,com.europosit.pixelcoloring,1840988,it is amazing I love pixel art: color by number it helps me become more creative when I have nothing to do!!!!!!,1,0,0,1
890297,Cash App,Peter Winkler,28-Jan-19,5,I usually don't write reviews but for this app I had to make an exception. This app and the corresponding card make managing money today much simpler. The support from Square is excellent and personal payments mske splitting bills headache free. I love that I no longer have to carry cash.,2019-03-08,FINANCE,Everyone,com.squareup.cash,1465398,I usually don't write reviews but for this app I had to make an exception. This app and the corresponding card make managing money today much simpler. The support from Square is excellent and personal payments mske splitting bills headache free. I love that I no longer have to carry cash.,1,0,0,1
1826,"Calm - Meditate, Sleep, Relax",A Google User,29-Jan-19,5,So far I have used the app nightly for a week. I have mild TBI and PTSD that I've suffered from an accident nearly four years ago and since then I suffer from chronic sleep deprivation. This app is helping me to fall asleep as well as helping me go back to sleep as I wake up throughout the night or when I have episodes of nightmares. So far I have only tried the soothing nature sound Audios.,2019-04-01,FITNESS,Everyone,com.calm.android,2204,So far I have used the app nightly for a week. I have mild TBI and PTSD that I've suffered from an accident nearly four years ago and since then I suffer from chronic sleep deprivation. This app is helping me to fall asleep as well as helping me go back to sleep as I wake up throughout the night or when I have episodes of nightmares. So far I have only tried the soothing nature sound Audios.,1,0,0,0
462508,Tubi - Free Movies & TV Shows,A Google User,24-Mar-19,3,didnt like the ads that pop up through out the movie..otherwise perfect.,2019-04-01,ENTERTAINMENT,Teen,com.tubitv,795454,didnt like the ads that pop up through out the movie..otherwise perfect.,0,0,0,1
471315,Tubi - Free Movies & TV Shows,Charlee Pafford,04-Apr-19,5,"great old movies, great scary movies, and great silly movies etc",2019-04-14,ENTERTAINMENT,Teen,com.tubitv,809619,"great old movies, great scary movies, and great silly movies etc",0,0,0,1
208515,Ball Mayhem!,Joe Got Games,18-Feb-19,1,bad. the guy with the ball just went through me and they were always 10X as fast,2019-03-24,ACTION,Everyone,com.clement.ballmayhem,307676,bad. the guy with the ball just went through me and they were always 10X as fast,0,0,0,1
746389,ClassDojo,Amimah Kaduji,15-Oct-18,5,I love the app,2019-04-07,EDUCATION,Everyone,com.classdojo.android,1244236,I love the app,0,0,0,1
200409,Ball Mayhem!,A Google User,03-Mar-19,5,it is awesome I can't explain it,2019-04-01,ACTION,Everyone,com.clement.ballmayhem,294246,it is awesome I can't explain it,0,0,0,1
45174,Samsung Health,Baka Mao,24-Feb-19,1,"no longer displays on lock screen hopping a negative review with force action to fix that problem, otherwise great product",2019-03-24,FITNESS,Everyone,com.sec.android.app.shealth,60411,"no longer displays on lock screen hopping a negative review with force action to fix that problem, otherwise great product",0,1,0,1
150726,Lose It! - Calorie Counter,Wesley Vecere,09-Jul-18,1,I get a threat when I scan for viruses APK:RepPo [Trj],2019-03-24,FITNESS,Everyone,com.fitnow.loseit,218778,I get a threat when I scan for viruses APK:RepPo [Trj],0,1,0,0
579798,"iHeartRadio - Free Music, Radio & Podcasts",Aaron Maus,15-Apr-19,5,low bandwith few commercials if u like ur list stil A+,2019-04-21,AUDIO,Teen,com.clearchannel.iheartradio.controller,990801,low bandwith few commercials if u like ur list stil A+,0,0,0,1
454110,"Hulu: Stream TV, Movies & more",Christopher Berghout,08-Apr-19,1,"Just watch TV? After every 30 minutes of content the app loses connectivity and have to ""retry."" to resume. Oh, and then the insidious commercials which start out short, then gradually lengthen, eating away at your soul. I signed up because it was a free perk of Spotify Premium service. If you hate being forcefed obnoxious, repeating, eye-wateringly stupid television ads, avoid downloading this BS app.",2019-04-14,ENTERTAINMENT,Teen,com.hulu.plus,783001,"Just watch TV? After every 30 minutes of content the app loses connectivity and have to ""retry."" to resume. Oh, and then the insidious commercials which start out short, then gradually lengthen, eating away at your soul. I signed up because it was a free perk of Spotify Premium service. If you hate being forcefed obnoxious, repeating, eye-wateringly stupid television ads, avoid downloading this BS app.",1,0,0,1
182624,CVS/pharmacy,A Google User,16-Feb-19,5,my favorite and most useful app,2019-04-14,FITNESS,Everyone,com.cvs.launchers.cvs,259907,my favorite and most useful app,0,0,0,1
938368,Chase Mobile,claudia rodriguez,12-Mar-19,1,finger print doesn't work and to slow or pending is a few days off,2019-03-24,FINANCE,Everyone,com.chase.sig.android,1542687,finger print doesn't work and to slow or pending is a few days off,0,1,0,0
363946,SmartThings,Jana Bartosova,14-Mar-19,1,set up to switch my TV on after arriving home. it's not working so don't see any reason to invest more. money to other smart things,2019-04-14,LIFESTYLE,Everyone,com.samsung.android.oneconnect,609171,set up to switch my TV on after arriving home. it's not working so don't see any reason to invest more. money to other smart things,1,1,0,0
311780,Tinder,Lamar McCroy,06-Mar-19,4,Its ok I guess. To me works better then all the other dating apps,2019-03-13,LIFESTYLE,Mature 17+,com.tinder,524065,Its ok I guess. To me works better then all the other dating apps,0,0,0,1
365236,SmartThings,troy owens,30-Mar-19,2,the selection of smart home devices pale in comparison to Google Assistant. Please add Eufy and Geeni products to smart home functionality for 5 stars.,2019-04-14,LIFESTYLE,Everyone,com.samsung.android.oneconnect,611671,the selection of smart home devices pale in comparison to Google Assistant. Please add Eufy and Geeni products to smart home functionality for 5 stars.,0,0,1,0
8176,"Calm - Meditate, Sleep, Relax",Lauren Aderman,12-Jan-19,5,I have used this app twice. both times I enjoyed it. I am now set up to use calm during my 15 min break.,2019-04-07,FITNESS,Everyone,com.calm.android,9769,I have used this app twice. both times I enjoyed it. I am now set up to use calm during my 15 min break.,1,0,0,0
601027,Amazon Music,Annie Perkins,28-Mar-19,5,Its great love this!,2019-04-01,AUDIO,Teen,com.amazon.mp3,1021347,Its great love this!,0,0,0,1
285982,Bowmasters,Venom _Drazzel,18-Apr-19,5,better than fortnite,2019-04-21,ACTION,Teen,com.miniclip.bowmasters,463823,better than fortnite,0,0,0,1
749795,ClassDojo,avarri Binion,20-Mar-19,5,to tell how people behavior is,2019-04-14,EDUCATION,Everyone,com.classdojo.android,1249777,to tell how people behavior is,0,0,0,1
75065,Calorie Counter - MyFitnessPal,Antonio Varona,14-Mar-19,5,great app for weiggt loss. seems to have q greater inventory of foods than other apps i have used.,2019-04-01,FITNESS,Everyone,com.myfitnesspal.android,108735,great app for weiggt loss. seems to have q greater inventory of foods than other apps i have used.,0,0,0,1
