id,appTitle,userName,date,score,text,fileDate,fileCategories,contentRating,appId,reviewId,processed_text,label_UE,label_BR,label_FR,label_R
977648,Bank of America Mobile Banking,Vincent G,07-Mar-19,5,i love this app,2019-03-08,FINANCE,Everyone,com.infonow.bofa,1596819,i love this app,0,0,0,1
406868,"Notepad - Notes with Reminder, ToDo, Sticky notes",James Bendernagel,10-Apr-19,3,good app. they need to improve the way the notes are catagorized. it would be nice if you could create sub folders instead of just have all the notes on one page and have to sift through them.,2019-04-21,LIFESTYLE,Everyone,notes.notebook.memo.pad.color.notepad.locker,687787,good app. they need to improve the way the notes are catagorized. it would be nice if you could create sub folders instead of just have all the notes on one page and have to sift through them.,0,0,1,1
887365,Cash App,Veronica Smith,14-Mar-19,4,very useful convenient it saves time and gas it helps me to send to my children in other states,2019-03-24,FINANCE,Everyone,com.squareup.cash,1461022,very useful convenient it saves time and gas it helps me to send to my children in other states,0,0,0,1
62242,Lose Belly Fat in 30 Days - Flat Stomach,,04-Jan-19,5,these app is really good¥£Ëí_í_í_¥£Ëí_í_í_¥£Ëí_í_í_¥£Ëí_í_í_,2019-03-24,FITNESS,Everyone,losebellyfat.flatstomach.absworkout.fatburning,88440,these app is really good,0,0,0,1
504801,Roku,Donnie M.,07-Feb-19,1,the app wont open on my Note 9 from tmobile. It is just a white screen with the logo. please fix,2019-03-13,ENTERTAINMENT,Teen,com.roku.remote,863318,the app wont open on my Note 9 from tmobile. It is just a white screen with the logo. please fix,0,1,0,0
929978,Credit Karma,Sherwin Life,11-Apr-19,4,I'll give them a 4 b/c they have 2 scores available for you to see and they're helpful and areas that you lack knowledge of.,2019-04-21,FINANCE,Everyone,com.creditkarma.mobile,1529144,I'll give them a 4 b/c they have 2 scores available for you to see and they're helpful and areas that you lack knowledge of.,0,0,0,1
480167,STARZ,A Google User,22-Mar-19,1,this is sooo bad it is dodo,2019-04-07,ENTERTAINMENT,Mature 17+,com.bydeluxe.d3.android.program.starz,823871,this is sooo bad it is dodo,0,0,0,1
20790,"Calm - Meditate, Sleep, Relax",A Google User,11-Mar-19,1,Was charged to my credit card before I thought it should. It's my fault but it still wrong. I thought it was a 14 day trial period.,2019-04-21,FITNESS,Everyone,com.calm.android,24962,Was charged to my credit card before I thought it should. It's my fault but it still wrong. I thought it was a 14 day trial period.,1,0,0,0
584148,Amazon Alexa,Lí¬l í_dí¬íŸt,15-Feb-19,3,"If you fixed the freezing on the skills, then I'll rate it 5 stars",2019-04-01,AUDIO,Everyone,com.amazon.dee.app,997493,"If you fixed the freezing on the skills, then I'll rate it 5 stars",0,1,0,0
887193,Cash App,A Google User,26-Feb-19,4,"very convenient.. would have given 5 stars, if the app didn't experience overload times",2019-04-07,FINANCE,Everyone,com.squareup.cash,1460798,"very convenient.. would have given 5 stars, if the app didn't experience overload times",0,1,0,1
1043015,YouTube Kids,Krunoslav Hrnjak,24-Mar-19,1,aaaa stop bugging with rate me on store,2019-04-21,FAMILY,Everyone,com.google.android.apps.youtube.kids,1712329,aaaa stop bugging with rate me on store,0,0,1,0
941395,Chase Mobile,Tani Freiwald,22-Mar-19,2,constantly locks me out and can not recognize my finget print but what choice do I have. fix your terrible app!,2019-04-14,FINANCE,Everyone,com.chase.sig.android,1548326,constantly locks me out and can not recognize my finget print but what choice do I have. fix your terrible app!,0,1,0,1
261697,Kick the Buddy,Chanel Dixon,09-Apr-19,1,is you down for two days I'm going to watch you up cuz it's the only time I'm going to shoot you on your head cuz he's dumb but look just like your what are you doing that since you don't think I'm going to try to,2019-04-14,ACTION,Teen,com.playgendary.kickthebuddy,410191,is you down for two days I'm going to watch you up cuz it's the only time I'm going to shoot you on your head cuz he's dumb but look just like your what are you doing that since you don't think I'm going to try to,1,0,0,0
1044862,Super Bino Go - New Games 2019,Carlena Page,23-Feb-19,5,Love the game.,2019-04-01,FAMILY,Everyone,com.superbinogo.jungleboyadventure,1717022,Love the game.,0,0,0,1
585648,Amazon Alexa,Ms Mo,07-Jan-19,1,Just got a new Echo. Can't even get through the setup. keeps kicking me out of the app when trying to connect WiFi.,2019-04-07,AUDIO,Everyone,com.amazon.dee.app,999607,Just got a new Echo. Can't even get through the setup. keeps kicking me out of the app when trying to connect WiFi.,0,1,0,0
987975,Fresh EBT - Food Stamp Balance,Lorraine Flanagin,21-Feb-19,5,makes things much easier for you,2019-04-07,FINANCE,Everyone,com.propel.ebenefits,1614740,makes things much easier for you,0,0,0,1
457167,"Hulu: Stream TV, Movies & more",Justin Hudson,21-Jan-19,1,I pay for the no ads version plus live tv and I'm still constantly seeing ads on shows I watch through the app. Even when I trouble shoot the app I still get ads on shows. Not to mention that anything I watch doesn't appear on my watch list so everytime I want to finish a show I have to start over. Absolute garbage for $48 per month!,2019-03-13,ENTERTAINMENT,Teen,com.hulu.plus,787267,I pay for the no ads version plus live tv and I'm still constantly seeing ads on shows I watch through the app. Even when I trouble shoot the app I still get ads on shows. Not to mention that anything I watch doesn't appear on my watch list so everytime I want to finish a show I have to start over. Absolute garbage for $48 per month!,0,1,0,1
601279,Amazon Music,Michelle DeZwaan,31-Mar-19,5,"Love it! Easy to find any genre, artist, album or song. Even snippets of songs usually brings up what I am looking for. I am completely satisfied with this app.",2019-04-01,AUDIO,Teen,com.amazon.mp3,1021780,"Love it! Easy to find any genre, artist, album or song. Even snippets of songs usually brings up what I am looking for. I am completely satisfied with this app.",1,0,0,1
453716,"Hulu: Stream TV, Movies & more",Kayli Williams,03-Feb-19,3,why would you take of the Divergent Series....u shiuld have some type of warning saying that movies are leaving soon or something...that made me rly mad,2019-04-14,ENTERTAINMENT,Teen,com.hulu.plus,782441,why would you take of the Divergent Series....u shiuld have some type of warning saying that movies are leaving soon or something...that made me rly mad,0,0,1,0
105101,Fitbit,simon george,15-Mar-19,5,really helpful gadget that keeps my health on track.,2019-03-16,FITNESS,Everyone,com.fitbit.FitbitMobile,147976,really helpful gadget that keeps my health on track.,0,0,0,1
98595,Fitbit,Elizabeth Vitkov,23-Mar-19,2,"""female"" tracking feels like afterthought the calendar to track menstruation is buggy. the drag and drop period calendar is hard to use. doesn't always drop where you put it. and the ""symptoms"" they list are too few. nausea? back pain? what if you want to add a note? or your own symptoms? nope. there are many better apps for this. also can you change the black background on the watch? I haven't figured out how to. my husband's samsung watch has tons of backgrounds. the app is almost useless.",2019-03-24,FITNESS,Everyone,com.fitbit.FitbitMobile,139363,"""female"" tracking feels like afterthought the calendar to track menstruation is buggy. the drag and drop period calendar is hard to use. doesn't always drop where you put it. and the ""symptoms"" they list are too few. nausea? back pain? what if you want to add a note? or your own symptoms? nope. there are many better apps for this. also can you change the black background on the watch? I haven't figured out how to. my husband's samsung watch has tons of backgrounds. the app is almost useless.",0,1,1,1
881388,IRS2Go,A Google User,23-Feb-16,1,Can't even get the thing to download !! Breen trying to download for 3 days now !! Just keeps loading,2019-04-21,FINANCE,Everyone,gov.irs,1452058,Can't even get the thing to download !! Breen trying to download for 3 days now !! Just keeps loading,0,1,0,0
357853,SmartThings,Mohammed Anwaruzzaman,22-Mar-19,3,my TV not once first use of the apps. everytime i need to reinstall the app and again connect the tv. Not saved my tv as a old device. previous version has no problem. after updates its not stable! disappointed,2019-04-07,LIFESTYLE,Everyone,com.samsung.android.oneconnect,597762,my TV not once first use of the apps. everytime i need to reinstall the app and again connect the tv. Not saved my tv as a old device. previous version has no problem. after updates its not stable! disappointed,0,1,0,1
977277,Bank of America Mobile Banking,,23-Mar-19,5,Easy to surf and find items,2019-03-24,FINANCE,Everyone,com.infonow.bofa,1596185,Easy to surf and find items,0,0,0,1
65686,Lose Belly Fat in 30 Days - Flat Stomach,Lori Belgarde,24-Feb-19,5,"great easy program, some exercises are tough, but has really helped me, and i do not exercise.",2019-03-16,FITNESS,Everyone,losebellyfat.flatstomach.absworkout.fatburning,94018,"great easy program, some exercises are tough, but has really helped me, and i do not exercise.",1,0,0,1
603592,Amazon Music,Pamela Streetman,30-Mar-19,5,"great music, easy access, lots of choices!",2019-04-07,AUDIO,Teen,com.amazon.mp3,1025562,"great music, easy access, lots of choices!",0,0,0,1
284628,Bowmasters,Qam Yasharahla,14-Apr-19,5,Luv I play every time I am in court,2019-04-14,ACTION,Teen,com.miniclip.bowmasters,460300,Luv I play every time I am in court,0,0,0,1
629,"Calm - Meditate, Sleep, Relax",grigorean evelina,27-Mar-19,1,one sound for free version.. you have to give some more to make me buy the rest..waste of time,2019-04-01,FITNESS,Everyone,com.calm.android,748,one sound for free version.. you have to give some more to make me buy the rest..waste of time,0,0,1,1
300798,Sniper 3D Gun Shooter: Free Elite Shooting Games,,22-Mar-19,5,Very good game Excellent shooting and excellent mission,2019-03-24,ACTION,Mature 17+,com.fungames.sniper3d,500486,Very good game Excellent shooting and excellent mission,0,0,0,1
688181,Remind: School Communication,ashley beauregard,08-Mar-19,5,great and helpful app for school,2019-04-07,EDUCATION,Everyone,com.remind101,1162510,great and helpful app for school,0,0,0,1
1050468,Super Bino Go - New Games 2019,Molina Chothe,10-Apr-19,5,I love this game so much,2019-04-21,FAMILY,Everyone,com.superbinogo.jungleboyadventure,1731538,I love this game so much,0,0,0,1
1039943,YouTube Kids,John Duckworth,26-Feb-19,1,"since youtube dont care enough to take these videos with the MoMo challenge lady down and find her amd prosecute her when she's telling kids to commit suicide as a challenge me and my wife and everyone we know are deleting the YouTube kids app and will no longer allow our kids to view youtube content of any kind. Youtubes owner has a suprise in store for them, I cant wait!",2019-03-13,FAMILY,Everyone,com.google.android.apps.youtube.kids,1705122,"since youtube dont care enough to take these videos with the MoMo challenge lady down and find her amd prosecute her when she's telling kids to commit suicide as a challenge me and my wife and everyone we know are deleting the YouTube kids app and will no longer allow our kids to view youtube content of any kind. Youtubes owner has a suprise in store for them, I cant wait!",1,0,0,1
698764,Remind: School Communication,Debra Noe,23-Jan-19,5,said they will stop servicing verizon customers- works great for our class so hope they don't!,2019-04-21,EDUCATION,Everyone,com.remind101,1176476,said they will stop servicing verizon customers- works great for our class so hope they don't!,0,0,1,1
879781,IRS2Go,dawn wise,17-Feb-18,5,"Strictly an app to help you ""locate your tax return!!! Easy and convenient",2019-04-21,FINANCE,Everyone,gov.irs,1449892,"Strictly an app to help you ""locate your tax return!!! Easy and convenient",0,0,0,1
138595,Drink Water Reminder: Water Tracker & Alarm,Slava Savelyev,14-Mar-19,1,too much advertisment,2019-03-24,FITNESS,Everyone,com.health.lab.drink.water.tracker,192799,too much advertisment,0,0,0,1
1067067,WildCraft: Animal Sim Online 3D,wolf cave in,05-Jan-19,3,i like it but there needs to be more land and time like fall and spring or like the big pine forests and rocky mountins,2019-04-01,FAMILY,Everyone 10+,com.turborocketgames.wildcraft,1762842,i like it but there needs to be more land and time like fall and spring or like the big pine forests and rocky mountins,0,0,1,1
872632,IRS2Go,A Google User,23-Mar-15,5,"Good app Installed to ck on my return, it was very accurate, return took 2 weeks. Was in my acct the day before irs app said it would. Now, loading again to ck on my boyfriends return. No problems, with crashing, freezing, or anything. Also, they update nightly, so checking multiple times in a day doesn't make a difference.",2019-03-08,FINANCE,Everyone,gov.irs,1440325,"Good app Installed to ck on my return, it was very accurate, return took 2 weeks. Was in my acct the day before irs app said it would. Now, loading again to ck on my boyfriends return. No problems, with crashing, freezing, or anything. Also, they update nightly, so checking multiple times in a day doesn't make a difference.",1,0,0,1
716012,Duolingo: Learn Languages Free,Miguel Junior Rodriguez,01-Apr-19,4,The best app,2019-04-07,FAMILY,Everyone,com.duolingo,1200341,The best app,0,0,0,1
1033538,Roblox,Rayven Luib,21-Apr-19,5,yeah i love this i made new friends with this game,2019-04-21,FAMILY,Everyone 10+,com.roblox.client,1688888,yeah i love this i made new friends with this game,0,0,0,1
98370,Fitbit,,09-Mar-19,5,"Fitbit app is a great guide for me. Set goals that are achievable, in exercise and the food tracker helps.",2019-03-24,FITNESS,Everyone,com.fitbit.FitbitMobile,139060,"Fitbit app is a great guide for me. Set goals that are achievable, in exercise and the food tracker helps.",0,0,0,1
93124,Calorie Counter - MyFitnessPal,Carly Williams,12-Apr-19,5,"This app has been amazing for counting calories for me! It's really intuitive and easy to use. I love being able to scan barcodes and search for basically anything. It's really easy to create new entries and add my own recipes too. I like the goals it sets and I love that it calculates my projected weight in five weeks based on what I eat each day. I haven't had luck linking it to map my walk (probably user error), but I haven't really minded because they both work well on their own.",2019-04-21,FITNESS,Everyone,com.myfitnesspal.android,132170,"This app has been amazing for counting calories for me! It's really intuitive and easy to use. I love being able to scan barcodes and search for basically anything. It's really easy to create new entries and add my own recipes too. I like the goals it sets and I love that it calculates my projected weight in five weeks based on what I eat each day. I haven't had luck linking it to map my walk (probably user error), but I haven't really minded because they both work well on their own.",1,0,0,1
613702,Amazon Music,Nona Pic,18-Apr-19,4,"I pay for Amazon prime,& this app is supposed to be free,with my prime. well it's free, I can download music,but then it starts ""blocking"" various songs I have ,& require me to pay for the unlimited version in order to receive the music, so basically it only gives you the music for a short time,then deletes it if you dont upgrade! Not happy!!",2019-04-21,AUDIO,Teen,com.amazon.mp3,1042054,"I pay for Amazon prime,& this app is supposed to be free,with my prime. well it's free, I can download music,but then it starts ""blocking"" various songs I have ,& require me to pay for the unlimited version in order to receive the music, so basically it only gives you the music for a short time,then deletes it if you dont upgrade! Not happy!!",0,0,1,1
150006,Lose It! - Calorie Counter,krysten o'connell,12-May-18,5,Great app works for me,2019-03-24,FITNESS,Everyone,com.fitnow.loseit,217968,Great app works for me,0,0,0,1
375376,FaceApp,JavaScript Vuejs,22-Mar-19,1,Almost everything is locked.,2019-04-01,LIFESTYLE,Everyone,io.faceapp,629901,Almost everything is locked.,0,0,1,0
321428,Family Locator - GPS Tracker,Jessica Perea,15-Mar-19,1,This app does not update locations as it should. Even when i refresh it. It's pretty frustrating trying to locate a family member in case of an emergency.,2019-04-01,LIFESTYLE,Everyone,com.life360.android.safetymapd,540026,This app does not update locations as it should. Even when i refresh it. It's pretty frustrating trying to locate a family member in case of an emergency.,0,1,0,0
789900,PBS KIDS Video,Sumaya Kelly,28-Jan-17,5,It's it's good for a kid like me to watch this kind of stuff it's kid appropriate.,2019-04-01,EDUCATION,Everyone,org.pbskids.video,1311778,It's it's good for a kid like me to watch this kind of stuff it's kid appropriate.,1,0,0,1
579320,"iHeartRadio - Free Music, Radio & Podcasts",Anthonyoni51 Lawon,19-Apr-19,5,soothing and good listening.,2019-04-21,AUDIO,Teen,com.clearchannel.iheartradio.controller,989910,soothing and good listening.,0,0,0,1
190375,Helix Jump,Verneeda Crowder,06-Mar-19,1,IT KEEPS LAGING EVERY TIME I PLAY IT KICKS ME OUT,2019-03-08,ACTION,Everyone,com.h8games.helixjump,274134,IT KEEPS LAGING EVERY TIME I PLAY IT KICKS ME OUT,0,1,0,0
741830,ClassDojo,Jennifer DeGaton,03-Nov-18,4,I really think that teachers should use thisä_,2019-03-08,EDUCATION,Everyone,com.classdojo.android,1236828,I really think that teachers should use this,0,0,0,1
632897,Apple Music,Sammy Turton,27-Mar-19,1,"App broken since last update, this update not fixed. Nokia",2019-04-01,AUDIO,Teen,com.apple.android.music,1074937,"App broken since last update, this update not fixed. Nokia",0,1,0,0
384060,The PCH App,kristina toto,20-Mar-19,1,"This app creates glitches and errors at times of good wins n bouses never gonna win jack!!! always freezes right b4 ginna hit 20,000$ spin n cheats you. Keep losing my vip elite n vip statuses cuz every now n then it wont load for a week straight some times more, n I try offten daily... paper n mail was more reliable. I build sites and apps n this one has waaaaay too many issues for me.",2019-03-24,LIFESTYLE,Everyone,pch.apps.pchsweeps,644912,"This app creates glitches and errors at times of good wins n bouses never gonna win jack!!! always freezes right b4 ginna hit 20,000$ spin n cheats you. Keep losing my vip elite n vip statuses cuz every now n then it wont load for a week straight some times more, n I try offten daily... paper n mail was more reliable. I build sites and apps n this one has waaaaay too many issues for me.",0,1,0,1
89766,Calorie Counter - MyFitnessPal,G. Sa,10-Apr-19,1,"I still get notifications of people trying to log in to my other accounts (twitch, google etc.) because myfitnesspal (or under armour?) leaked the login data of 150 million user accounts.",2019-04-14,FITNESS,Everyone,com.myfitnesspal.android,127785,"I still get notifications of people trying to log in to my other accounts (twitch, google etc.) because myfitnesspal (or under armour?) leaked the login data of 150 million user accounts.",0,0,0,1
428544,Netflix,kunal Purbia,01-Apr-19,1,month charges are very high,2019-04-01,ENTERTAINMENT,Teen,com.netflix.mediaclient,739840,month charges are very high,0,0,0,1
197565,Helix Jump,M Swarts,21-Apr-19,5,addictive and fun,2019-04-21,ACTION,Everyone,com.h8games.helixjump,288963,addictive and fun,0,0,0,1
669439,Photomath,,26-Feb-19,5,it is awesome and gave me the confidence I need for math,2019-03-08,EDUCATION,Everyone,com.microblink.photomath,1133538,it is awesome and gave me the confidence I need for math,0,0,0,1
399259,"Notepad - Notes with Reminder, ToDo, Sticky notes",,23-Feb-19,5,its good for my needs,2019-03-13,LIFESTYLE,Everyone,notes.notebook.memo.pad.color.notepad.locker,674114,its good for my needs,0,0,0,1
217208,Tomb of the Mask,Sean Logan,19-Mar-19,4,it's fun but I didn't know the blue kills you but the rest is awesome,2019-04-01,ACTION,Everyone,com.playgendary.tom,321798,it's fun but I didn't know the blue kills you but the rest is awesome,0,0,0,1
787633,Google Classroom,A Google User,26-Oct-18,5,This app is great for schoolwork to finish at home and helps keep up grades,2019-04-21,EDUCATION,Everyone,com.google.android.apps.classroom,1307917,This app is great for schoolwork to finish at home and helps keep up grades,0,0,0,1
401367,"Notepad - Notes with Reminder, ToDo, Sticky notes",Joanne 22,23-Dec-18,5,"The most efficient , easy, organized way to create and access shopping lists , memos , and notes for everyday use!!!_ôÖ_",2019-03-24,LIFESTYLE,Everyone,notes.notebook.memo.pad.color.notepad.locker,677679,"The most efficient , easy, organized way to create and access shopping lists , memos , and notes for everyday use!!!",0,0,0,1
101706,Fitbit,Renie Doherty,03-Apr-19,5,Very accurate on steps and distance for better calorie logging. For daily activity and sleep tracker it is better than my Garmin runners watch and vivosport. Garmin is better for tracking training info. Flex is slim for better daily wear comfort and love it is water proof.,2019-04-07,FITNESS,Everyone,com.fitbit.FitbitMobile,143484,Very accurate on steps and distance for better calorie logging. For daily activity and sleep tracker it is better than my Garmin runners watch and vivosport. Garmin is better for tracking training info. Flex is slim for better daily wear comfort and love it is water proof.,1,0,0,1
435395,Netflix,Jvaughn GRIFFIN,09-Apr-19,5,The app is amazing 5stars,2019-04-14,ENTERTAINMENT,Teen,com.netflix.mediaclient,752678,The app is amazing 5stars,0,0,0,1
739886,ClassDojo,A Google User,26-Feb-19,5,it the best,2019-04-01,EDUCATION,Everyone,com.classdojo.android,1233631,it the best,0,0,0,1
824453,Quizlet: Learn Languages & Vocab with Flashcards,Ramithaa 'Jay' Deva,19-Mar-19,2,It doesn't want to open_ôÖ´,2019-04-21,EDUCATION,Everyone,com.quizlet.quizletandroid,1361584,It doesn't want to open,0,1,0,0
989869,Fresh EBT - Food Stamp Balance,Teresa Gladhart,30-Mar-19,5,i really like this app. very user friendly and uptodate!!,2019-04-07,FINANCE,Everyone,com.propel.ebenefits,1617859,i really like this app. very user friendly and uptodate!!,0,0,0,1
697803,Remind: School Communication,Natashia Wallace,21-Feb-19,5,Love this app! Very easy to get in contact with my children's teacher's! Even if it's a Last Minute thing that I need to tell them! I've personally Never had Any Issues out of Remind!,2019-04-21,EDUCATION,Everyone,com.remind101,1175174,Love this app! Very easy to get in contact with my children's teacher's! Even if it's a Last Minute thing that I need to tell them! I've personally Never had Any Issues out of Remind!,1,0,0,1
913642,PayPal Mobile Cash: Send and Request Money Fast,Jim B,18-Apr-19,4,"good app, easy to use",2019-04-21,FINANCE,Everyone,com.paypal.android.p2pmobile,1504025,"good app, easy to use",0,0,0,1
757231,ABCmouse.com,Emily Sisam,28-Aug-18,5,It is very educational,2019-04-01,EDUCATION,Everyone,mobi.abcmouse.academy_goo,1261385,It is very educational,0,0,0,1
457964,"Hulu: Stream TV, Movies & more",Ray Felix,12-Apr-19,1,not free......wants money in 30 days...not what I want,2019-04-21,ENTERTAINMENT,Teen,com.hulu.plus,788417,not free......wants money in 30 days...not what I want,0,0,0,1
598217,Amazon Alexa,Jackie DeCosta,02-Mar-19,2,My Alexa doesn't stay connected. It used to great but its a pain to set up every time I try to use it!,2019-04-21,AUDIO,Everyone,com.amazon.dee.app,1017100,My Alexa doesn't stay connected. It used to great but its a pain to set up every time I try to use it!,0,1,0,1
691002,Remind: School Communication,britanykirbyon stufko,24-Jan-19,5,I love this app keeps me update with everything at school with my kids. _ôÖó_ôÖó,2019-03-24,EDUCATION,Everyone,com.remind101,1166204,I love this app keeps me update with everything at school with my kids. ,0,0,0,1
942552,Chase Mobile,Chris K,02-Apr-19,4,"Good app overall, easy to navigate and has lots of useful info regarding your accounts. I would like to see them add a running tab of the balance next to the purchases and payments though.",2019-04-14,FINANCE,Everyone,com.chase.sig.android,1549992,"Good app overall, easy to navigate and has lots of useful info regarding your accounts. I would like to see them add a running tab of the balance next to the purchases and payments though.",0,0,1,1
710338,Duolingo: Learn Languages Free,NBAbri 203,02-Apr-19,5,this app i great you need to get this app.its very helpful it tells you how to pronounce....its just a good app._ôÖ__ôÖ__ôÖ_,2019-04-07,EDUCATION,Everyone,com.duolingo,1192686,this app i great you need to get this app.its very helpful it tells you how to pronounce....its just a good app.,0,0,0,1
254997,Kick the Buddy,Zackary Driegen,27-Mar-19,5,so much fun. Releases my stress,2019-04-01,ACTION,Teen,com.playgendary.kickthebuddy,394750,so much fun. Releases my stress,0,0,0,1
1098984,Toca Kitchen 2,,17-Feb-19,5,umm I think that you could add more peole on and my complain is that you cant make a sandwich and a cake it would be cool if you could do that onto my complain it takes alot of stuf on your phone to download this app but the app isent even important my 3rd complain is it take a long time download this app,2019-03-24,FAMILY,Everyone,com.tocaboca.tocakitchen2,1808166,umm I think that you could add more peole on and my complain is that you cant make a sandwich and a cake it would be cool if you could do that onto my complain it takes alot of stuf on your phone to download this app but the app isent even important my 3rd complain is it take a long time download this app,0,0,1,0
